"This Cart2Quote license does not allow for API access","Deze Cart2Quote-licentie staat geen API-toegang toe"
"Creating a quote pdf is not allowed for the registered license, please upgrade to a higher edition.","Het maken van een offerte pdf is niet toegestaan voor de geregistreerde licentie, upgrade naar een hogere versie."
"Error[9001]: Unable to submit quote, please login to request a quote.","Error[9001]: Niet in staat om offerte in te dienen, log in om een offerte aan te vragen."
"Optional items are not allowed for this license, please upgrade to a higher edition.","Optionele items zijn niet toegestaan voor deze licentie, upgrade naar een hogere versie."
"Editing the Quote Status is not allowed for this license, please upgrade to a higher edition.","Het bewerken van de Quote-status is niet toegestaan voor deze licentie, upgrade naar een hogere versie."
"Editing a quote is not allowed for this license, please upgrade to a higher edition.","Het bewerken van een offerte is niet toegestaan voor deze licentie, upgrade naar een hogere versie."
"Thanks for trying Cart2Quote. We hope you have been enjoying your free trial. To continue receiving, accessing and processing quote requests visit our Editions & Prices page [https://www.cart2quote.com/magento2-quotation-module-editions.html] to purchase a Cart2Quote license.","Bedankt voor het proberen van Cart2Quote. We hopen dat je dat bent geweest geniet van je gratis proefperiode. Om door te gaan met het ontvangen, openen en verwerken van prijsverzoeken, bezoekt u onze Editions & Prices Pagina [https://www.cart2quote.com/magento2-quotation-module-editions.html] om een Cart2Quote-licentie te kopen."